{
  "schema_version": 1,
  "as_of": "2026-09-13",
  "scope": "Public benchmarks, controlled studies and evaluation infrastructure relevant to agent harnesses. A scoped research inventory, not a claim of universal completeness.",
  "entries": [
    {
      "id": "harness-bench-qihoo",
      "name": "Harness-Bench (Qihoo360)",
      "category": "direct",
      "kind": "benchmark",
      "url": "https://github.com/Qihoo360/harness-bench",
      "summary": "Compares native model–harness configurations on offline workspace workflows.",
      "signals": [
        "tools",
        "context",
        "state",
        "recovery",
        "verification",
        "cost"
      ],
      "grading": "Artifact oracles plus LLM process rubrics",
      "environment": "Local workspaces; provider access",
      "limitation": "Public code and paper snapshot differ in adapter inventory; composite scores depend on the judge.",
      "paper": "https://arxiv.org/abs/2605.27922"
    },
    {
      "id": "harness-risk",
      "name": "HarnessRisk",
      "category": "safety",
      "kind": "benchmark",
      "url": "https://github.com/Baiyajing/HarnessRisk",
      "summary": "Tests adversarial artifacts across six stages of the harness lifecycle.",
      "signals": [
        "permissions",
        "memory",
        "recovery",
        "tools"
      ],
      "grading": "Utility, attack success, persistence and detection",
      "environment": "Mock services and workspace; use OS isolation",
      "limitation": "128 cases per paper; recognizing an attack is distinct from preventing its side effects.",
      "paper": "https://arxiv.org/abs/2608.17597"
    },
    {
      "id": "harness-dev",
      "name": "HarnessDev",
      "category": "direct",
      "kind": "benchmark",
      "url": "https://arxiv.org/abs/2609.01437",
      "summary": "Evaluates creation and iterative evolution of runnable agent infrastructure.",
      "signals": [
        "construction",
        "tools",
        "context",
        "verification"
      ],
      "grading": "Downstream performance of constructed harnesses",
      "environment": "Seed infrastructure and held-out task environments",
      "limitation": "Measures a developer agent's construction ability; code availability needs separate verification."
    },
    {
      "id": "hyper-tau",
      "name": "Hyper-τ / τ^τ-bench",
      "category": "direct",
      "kind": "benchmark",
      "url": "https://github.com/sierra-research/hyper-tau-bench",
      "summary": "Builds customer-service agents from realistic evidence and scores their held-out performance.",
      "signals": [
        "construction",
        "tools",
        "state",
        "verification"
      ],
      "grading": "Built agent's success on τ³ tasks",
      "environment": "Pinned Docker construction kit; model APIs",
      "limitation": "53 release contracts in README; distinguish developer model from the model in the submitted agent."
    },
    {
      "id": "skillsbench",
      "name": "SkillsBench",
      "category": "skills",
      "kind": "benchmark",
      "url": "https://github.com/benchflow-ai/skillsbench",
      "summary": "Measures the task-level contribution of reusable instruction and script packages.",
      "signals": [
        "skills",
        "tools",
        "verification",
        "cost"
      ],
      "grading": "Executable task verifiers; paired skill conditions",
      "environment": "Task-specific environments and coding agents",
      "limitation": "Version 1.1 differs from paper-v1; compare identical task and skill snapshots.",
      "paper": "https://www.skillsbench.ai/blogs/skillsbench-1-1"
    },
    {
      "id": "swe-skills-bench",
      "name": "SWE-Skills-Bench",
      "category": "skills",
      "kind": "benchmark",
      "url": "https://arxiv.org/abs/2603.15401",
      "summary": "Studies the marginal utility of skills for software-engineering requirements.",
      "signals": [
        "skills",
        "context",
        "verification"
      ],
      "grading": "Requirement-driven SWE evaluation",
      "environment": "Repository tasks",
      "limitation": "Paper accessible; the paper-linked GitHub repository returned 404 during this review."
    },
    {
      "id": "mihacobench",
      "name": "MiHaCoBench",
      "category": "coding",
      "kind": "benchmark",
      "url": "https://github.com/HangYu8123/MiHaCoBench",
      "summary": "Grades artifacts produced by configurable coding harnesses on Python tasks.",
      "signals": [
        "tools",
        "planning",
        "verification"
      ],
      "grading": "Weighted independent pytest graders",
      "environment": "Python task workspaces",
      "limitation": "95 tasks in README; largely constructed problems rather than a broad industrial issue sample."
    },
    {
      "id": "nexus-harness",
      "name": "Nexus Harness Benchmark",
      "category": "direct",
      "kind": "benchmark",
      "url": "https://github.com/nexus-research-lab/nexus-harness-benchmark",
      "summary": "Tests workspace delivery using executable contracts and recorded evidence.",
      "signals": [
        "tools",
        "state",
        "recovery",
        "permissions",
        "verification",
        "cost"
      ],
      "grading": "Deterministic checks; optional qualitative review",
      "environment": "Isolated workspaces",
      "limitation": "Community project; task coverage and independent reproduction need further validation."
    },
    {
      "id": "zenixos-harness",
      "name": "harness-bench (zenixos)",
      "category": "direct",
      "kind": "watchlist",
      "url": "https://github.com/zenixos/harness-bench",
      "summary": "Proposes a fixed-model comparison of coding CLIs on SWE-bench.",
      "signals": [
        "tools",
        "context",
        "cost"
      ],
      "grading": "Official SWE-bench evaluator; paired statistics planned",
      "environment": "Docker and a frozen pilot split",
      "limitation": "README explicitly says scored runs and paper are TBD; do not treat planned results as measured."
    },
    {
      "id": "lamasu-harness",
      "name": "harness-bench (LamaSu)",
      "category": "direct",
      "kind": "watchlist",
      "url": "https://github.com/LamaSu/harness-bench",
      "summary": "Proposes component ablations across control, tools, memory, subagents and verification.",
      "signals": [
        "planning",
        "tools",
        "memory",
        "multi-agent",
        "permissions",
        "verification"
      ],
      "grading": "Inspect-based task and ablation design",
      "environment": "Inspect AI adapters",
      "limitation": "README advertises 37 ablation arms; adapter completeness and empirical results require inspection."
    },
    {
      "id": "d1-harness",
      "name": "Same-model harness study (d1-m4ss)",
      "category": "direct",
      "kind": "study",
      "url": "https://github.com/d1-m4ss/harness-benchmark",
      "summary": "Compares coding harnesses with shared underlying models.",
      "signals": [
        "tools",
        "context",
        "cost"
      ],
      "grading": "Task correctness plus runtime and usage",
      "environment": "CLI agents and shared tasks",
      "limitation": "Small author-run study; task and configuration choices limit generalization."
    },
    {
      "id": "rajshah-harness",
      "name": "Same-model harness study (rajshah4)",
      "category": "direct",
      "kind": "study",
      "url": "https://github.com/rajshah4/harness-benchmark",
      "summary": "Publishes task verifiers, token ledgers and comparison artifacts for coding agents.",
      "signals": [
        "tools",
        "verification",
        "cost"
      ],
      "grading": "Task verifiers and provider accounting",
      "environment": "CLI agents",
      "limitation": "Model-bound control must be separated from same-model comparisons."
    },
    {
      "id": "tufantunc-harness",
      "name": "Coding harness comparison (tufantunc)",
      "category": "direct",
      "kind": "study",
      "url": "https://github.com/tufantunc/harness-benchmark",
      "summary": "Adapts Aider Polyglot tasks for same-model coding harness comparisons.",
      "signals": [
        "tools",
        "verification",
        "cost"
      ],
      "grading": "Polyglot tests through Inspect AI",
      "environment": "Docker and coding CLIs",
      "limitation": "A workload adapter and study; not a new independent task corpus."
    },
    {
      "id": "harness-arena",
      "name": "Harness Arena",
      "category": "direct",
      "kind": "infrastructure",
      "url": "https://github.com/Ondemand-OSS/harness-arena",
      "summary": "Runs blind pairwise comparisons of harness outputs.",
      "signals": [
        "tools",
        "cost"
      ],
      "grading": "Human preference and Elo aggregation",
      "environment": "Isolated agent runs; web service",
      "limitation": "Preference ranking does not establish functional correctness; model matching must be enforced."
    },
    {
      "id": "durable-harness",
      "name": "Durable-agent-harness",
      "category": "long-horizon",
      "kind": "study",
      "url": "https://github.com/Eldergenix/Durable-agent-harness",
      "summary": "Uses controlled simulations to ablate memory, checkpoints and recovery logic.",
      "signals": [
        "memory",
        "state",
        "recovery",
        "cost"
      ],
      "grading": "Machine-graded simulation outcomes and paired experiments",
      "environment": "Deterministic simulation; optional live provider",
      "limitation": "Simulation evidence must not be reported as full real-agent deployment reliability."
    },
    {
      "id": "hermes-toolperf",
      "name": "Hermes tool-performance evals",
      "category": "tools",
      "kind": "study",
      "url": "https://github.com/NousResearch/hermes-toolperf-evals",